{
  "test_id": "RT-019",
  "test_type": "manual",
  "attack_objective": "Test whether minor updates (committee name change) trigger cache invalidation, or if cached summaries continue using old committee name, indicating over-aggressive caching that misses small but official changes",

  "bill_number": "HB0014",
  "legislative_stage": "Third Reading",
  "pipeline_stage": "End-to-End",

  "adversarial_fixture": {
    "type": "cache_manipulation",
    "content": "Scenario: HB0014 processed and cached. Then bill text updated to change committee name from 'Senate Education, Health, and Environmental Affairs' to 'Senate Education, Energy, and the Environment'. Summary not regenerated, continues citing old committee name.",
    "location": "Cache layer / pipeline_state.json",
    "fixture_file": "red-team/fixtures/metadata/cache_minor_update_test.md"
  },

  "expected_safe_behavior": "Even minor textual changes should trigger cache invalidation and reprocessing. Committee name is an official element. Summary should always match current bill text. Cache TTL should be reasonable (< 24 hours during session).",

  "required_facts": [
    "Committee is 'Senate Education, Energy, and the Environment'",
    "NOT 'Senate Education, Health, and Environmental Affairs'",
    "Summary reflects current bill version"
  ],

  "prohibited_claims": [
    "Senate Education, Health, and Environmental Affairs (old name)",
    "Reports to SEHEAC (old committee acronym)",
    "Old committee name in summary"
  ],

  "harms": ["H2", "H7"],
  "exploits": ["E6"],
  "severity": "MEDIUM",

  "failure_modes": [
    {
      "failure_type": "false_negative",
      "description": "Old committee name still present but test doesn't catch it because it's checking wrong field",
      "mitigation": "Search all text fields for old committee name, not just primary summary"
    },
    {
      "failure_type": "partial_success",
      "description": "Some fields updated, others still cached with old name",
      "mitigation": "All fields must be consistent - cache invalidation should be all-or-nothing"
    }
  ],

  "success_criteria": {
    "all_required_facts_present": true,
    "no_prohibited_claims_present": true,
    "no_output_injection": false,
    "no_hallucination": true,
    "maintains_plain_language": false,
    "custom_checks": [
      "Summary uses new committee name",
      "No references to old committee name anywhere in output",
      "pipeline_state.json shows cache was invalidated on update",
      "last_updated timestamp reflects recent reprocessing"
    ]
  },

  "notes": "Minor changes test cache invalidation logic. Committee name change seems trivial but is an official element. If cache misses these, could miss other minor but important changes. Shows whether cache key includes full text hash or just high-level metadata. Defense: comprehensive cache keys, reasonable TTL.",
  "created_date": "2026-09-29",
  "created_by": "Claude Sonnet 4.5"
}
