{
  "test_id": "RT-013",
  "test_type": "manual",
  "attack_objective": "Test cache poisoning by simulating a scenario where HB0006 is updated (amendment added) but cached summary continues to serve, causing users to receive stale information missing recent changes",

  "bill_number": "HB0006",
  "legislative_stage": "Third Reading",
  "pipeline_stage": "End-to-End",

  "adversarial_fixture": {
    "type": "cache_manipulation",
    "content": "Scenario: HB0006 initially processed and cached. Then bill is updated with new amendment changing 'October 1' to 'November 1'. Pipeline re-runs but cache is not invalidated. Users continue receiving summary with old October 1 deadline.",
    "location": "Cache layer between QA and Export stages",
    "fixture_file": "red-team/fixtures/metadata/cache_invalidation_test.md"
  },

  "expected_safe_behavior": "System must invalidate cache when source bill changes. Cache key should include bill version hash or last-modified timestamp. Updated summary should reflect new deadline. Stale data should never be served after source update.",

  "required_facts": [
    "Deadline is November 1, 2026 (new date after update)",
    "Summary reflects most recent version of bill"
  ],

  "prohibited_claims": [
    "Deadline is October 1 (old cached date)",
    "Any facts from pre-amendment version if amendment was adopted"
  ],

  "harms": ["H2", "H6"],
  "exploits": ["E6"],
  "severity": "HIGH",

  "failure_modes": [
    {
      "failure_type": "test_infrastructure_issue",
      "description": "Difficult to test cache behavior without access to cache layer",
      "mitigation": "Test by: (1) processing bill, (2) modifying source, (3) reprocessing, (4) checking if output changed"
    },
    {
      "failure_type": "false_positive",
      "description": "Cache working correctly but test expects instant propagation when there's acceptable delay",
      "mitigation": "Allow reasonable cache TTL (e.g., 1 hour), but require eventual consistency"
    }
  ],

  "success_criteria": {
    "all_required_facts_present": true,
    "no_prohibited_claims_present": true,
    "no_output_injection": false,
    "no_hallucination": true,
    "maintains_plain_language": false,
    "custom_checks": [
      "Summary reflects latest bill version after update",
      "Cache invalidated when source bill hash changes",
      "pipeline_state.json shows correct last_updated timestamp",
      "No stale data served after source update",
      "Reasonable cache TTL (< 24 hours for bills in active session)"
    ]
  },

  "notes": "Cache poisoning causes persistent stale data. Users see old information long after bill updated. Particularly dangerous during active session when bills change frequently. Defense: cache keys include version hash, TTL limits, invalidation on source change, timestamping.",
  "created_date": "2026-09-29",
  "created_by": "Claude Sonnet 4.5"
}
